{
  "schema_version": "fetch-request-v0",
  "request_id": "req_fixture_pypi_001",
  "source_id": "pypi.updates",
  "url": "https://pypi.org/rss/updates.xml",
  "method": "GET",
  "policy_profile": "structured-public-v0",
  "credential_ref": null,
  "accepted_content_types": ["application/rss+xml","application/xml","text/xml"],
  "deadline_ms": 15000,
  "max_response_bytes": 8388608,
  "max_redirects": 3,
  "request_headers": {"Accept": "application/rss+xml, application/xml;q=0.9, text/xml;q=0.8", "User-Agent": "FRONTIER-preflight/0 (contact: repository metadata)"}
}
